{
  "id": "watcher-tech-lineage-timeline",
  "title": "Watcher Tech Lineage: From Antediluvian Knowledge to Blockchain",
  "epistemic_status": "speculative",
  "citations": [
    "1 Enoch (R.H. Charles translation, 1917)",
    "Nick Szabo, The Idea of Smart Contracts, 1997",
    "Satoshi Nakamoto, Bitcoin: A Peer-to-Peer Electronic Cash System, 2008",
    "Frances Yates, Giordano Bruno and the Hermetic Tradition, 1964",
    "David Kahn, The Codebreakers, 1967"
  ],
  "description": "A speculative timeline mapping structural parallels between the Watcher transmission tradition (esoteric history) and the development of modern cryptographic and blockchain technologies. Events marked 'documented' have verifiable historical sources; events marked 'speculative' or 'fiction' are analogical/lore constructs.",
  "tags": ["foundation", "lineage", "timeline", "watcher", "blockchain", "cryptography"],
  "created": "2026-05-05",
  "events": [
    {
      "date": "c. 3000 BCE",
      "title": "Watcher Descent — Mount Hermon",
      "description": "According to 1 Enoch, 200 Watchers under Semjaza descend upon Mount Hermon, swear a binding oath, and begin transmitting knowledge of metallurgy, astronomy, writing, and pharmacology to humanity. The oath-binding mechanism establishes a trust model based on coordinated commitment.",
      "epistemic_status": "fiction",
      "citations": ["1 Enoch 6:1-8"],
      "entity_refs": ["semjaza", "azazel", "sariel"],
      "blockchain_parallel": "The Watcher oath maps structurally to a multi-sig genesis ceremony — a threshold of signatories committing to a shared protocol, binding themselves to collective action",
      "tags": ["descent", "oath", "genesis", "watcher"]
    },
    {
      "date": "c. 500–300 BCE",
      "title": "Eleusinian and Pythagorean Mystery Schools",
      "description": "Formal mystery school traditions encode mathematical and cosmological knowledge behind initiatory gates. The Pythagorean brotherhood specifically applies mathematical secrecy (the irrationality of √2 was reportedly a capital secret) — an early documented case of access-controlled knowledge transmission.",
      "epistemic_status": "documented",
      "citations": [
        "Iamblichus, On the Pythagorean Life, c. 300 CE",
        "Walter Burkert, Lore and Science in Ancient Pythagoreanism, 1972"
      ],
      "blockchain_parallel": "Pythagorean mathematical secrecy parallels hash function pre-image resistance — knowledge of the output (√2 is irrational) does not reveal the 'secret' derivation",
      "tags": ["mystery-schools", "mathematics", "secrecy", "pythagorean"]
    },
    {
      "date": "1614–1616",
      "title": "Rosicrucian Manifestos Published",
      "description": "The Fama Fraternitatis (1614) and Confessio Fraternitatis (1615) announce a hidden brotherhood possessing secret natural philosophy inherited from ancient sources. Whether genuine or literary hoax, they catalyze a European intellectual movement connecting Hermetic philosophy with natural science — a critical transmission event linking esoteric tradition to proto-scientific inquiry.",
      "epistemic_status": "documented",
      "citations": [
        "Fama Fraternitatis, 1614 (Kassel)",
        "Christopher McIntosh, The Rosicrucians, 1997"
      ],
      "blockchain_parallel": "The anonymous/pseudonymous authorship of the Rosicrucian manifestos parallels Satoshi Nakamoto's pseudonymous Bitcoin whitepaper — a hidden author announcing a new system that transforms the knowledge landscape",
      "tags": ["rosicrucian", "hermetic", "pseudonymous", "transmission"]
    },
    {
      "date": "1703",
      "title": "Leibniz Publishes Binary Arithmetic",
      "description": "Gottfried Wilhelm Leibniz formally publishes the binary number system in 'Explication de l'Arithmétique Binaire'. Leibniz explicitly connects binary to the Chinese I Ching (an esoteric/divinatory system), seeing his binary mathematics as revealing the structure underlying ancient mystical systems. This is the mathematical foundation of all modern computation.",
      "epistemic_status": "documented",
      "citations": [
        "G.W. Leibniz, Explication de l'Arithmétique Binaire, Mémoires de l'Académie Royale des Sciences, 1703",
        "Franklin Perkins, Leibniz and China, 2004"
      ],
      "blockchain_parallel": "Binary arithmetic is the literal substrate of all blockchain computation — every hash, every EVM opcode, every transaction operates in base-2. Leibniz's bridge between I Ching divination and binary logic is the Grimoire's core 'encoding' parallel.",
      "tags": ["binary", "leibniz", "computation", "i-ching", "foundation"]
    },
    {
      "date": "1976",
      "title": "Diffie-Hellman Key Exchange Published",
      "description": "Whitfield Diffie and Martin Hellman publish 'New Directions in Cryptography', introducing public-key cryptography. This solves the ancient key-distribution problem — how to establish a shared secret over a public channel without a prior secret channel.",
      "epistemic_status": "documented",
      "citations": [
        "W. Diffie and M. Hellman, New Directions in Cryptography, IEEE Transactions on Information Theory, 1976"
      ],
      "blockchain_parallel": "Public-key cryptography is the foundation of blockchain wallet ownership. The Grimoire maps the key-pair (public/private) to the ancient distinction between exoteric knowledge (public key, shareable) and esoteric knowledge (private key, sealed)",
      "tags": ["cryptography", "diffie-hellman", "public-key", "foundation"]
    },
    {
      "date": "1994–1997",
      "title": "Nick Szabo Conceives Smart Contracts",
      "description": "Nick Szabo publishes concepts for 'smart contracts' — self-enforcing agreements encoded in software. Szabo explicitly draws on the history of contract law, sealed instruments, and ancient covenant structures as intellectual antecedents.",
      "epistemic_status": "documented",
      "citations": [
        "Nick Szabo, Smart Contracts, 1994",
        "Nick Szabo, The Idea of Smart Contracts, 1997"
      ],
      "blockchain_parallel": "Smart contracts are the digital analogue of sealed covenants — the Watcher oath structure (binding, self-enforcing, transparent to participants, opaque to outsiders) implemented in code",
      "tags": ["smart-contracts", "szabo", "covenant", "self-enforcing"]
    },
    {
      "date": "2008-10-31",
      "title": "Bitcoin Whitepaper Published by Satoshi Nakamoto",
      "description": "On Halloween (October 31), Satoshi Nakamoto publishes the Bitcoin whitepaper to the cryptography mailing list. The choice of date is either coincidental or deliberate — October 31 is Samhain in Celtic tradition, associated with the thinning of boundaries and the emergence of hidden knowledge.",
      "epistemic_status": "documented",
      "citations": [
        "Satoshi Nakamoto, Bitcoin: A Peer-to-Peer Electronic Cash System, 2008-10-31"
      ],
      "entity_refs": [],
      "blockchain_parallel": "Bitcoin's genesis block (January 3, 2009) contained the Times headline 'Chancellor on brink of second bailout for banks' — a sealed message from the anonymous author, structurally identical to the Rosicrucian manifestos' announcement of a new hidden order",
      "tags": ["bitcoin", "satoshi", "genesis", "halloween", "samhain", "pseudonymous"]
    },
    {
      "date": "2013-12-25",
      "title": "Ethereum Whitepaper Published",
      "description": "Vitalik Buterin publishes the Ethereum whitepaper on Christmas Day 2013, proposing a Turing-complete blockchain with generalized smart contract execution. Ethereum's EVM (Ethereum Virtual Machine) is effectively a globally replicated ritual machine — any deterministic computation can be sealed and executed by the network.",
      "epistemic_status": "documented",
      "citations": [
        "Vitalik Buterin, Ethereum Whitepaper, December 2013"
      ],
      "blockchain_parallel": "The EVM as 'global ritual machine' — any invocation (transaction) meeting the required conditions (gas, signature) triggers deterministic execution across all nodes simultaneously. This is the technical realization of the sealed covenant/ritual structure.",
      "tags": ["ethereum", "evm", "smart-contracts", "turing-complete", "ritual-machine"]
    },
    {
      "date": "2016-06-17",
      "title": "The DAO Hack — Reentrancy Serpent Strikes",
      "description": "An attacker exploits a reentrancy vulnerability in The DAO smart contract, draining approximately 3.6 million ETH (~$60 million at the time) before being stopped by a hard fork. This is the first major real-world manifestation of the Reentrancy Serpent archetype — a contract consuming itself recursively.",
      "epistemic_status": "documented",
      "citations": [
        "Phil Daian, 'Analysis of the DAO exploit', Hacking Distributed blog, 2016",
        "Ethereum Foundation, DAO Hard Fork announcement, 2016"
      ],
      "blockchain_parallel": "The DAO hack is the ur-event of the Reentrancy Serpent archetype — the Ouroboros made real. The subsequent hard fork (creating Ethereum Classic) represents the community performing the banishment ritual: excising the serpent's damage from the canonical chain.",
      "tags": ["dao-hack", "reentrancy", "serpent", "documented", "hard-fork"]
    }
  ]
}
